ORDER_ID	LINE	CLIN_IND_TEXT	CLIN_IND_CMT_TEXT
772179262	1	Essential (primary) hypertension	Received over interface (750303,197967350)
439060606	1	Persons encountering health services in other specified circumstances	Received over interface (750303,104625612)
439060607	1	Gastro-esophageal reflux disease without esophagitis	Received over interface (750303,105202123)
439060607	2	Epigastric pain	Received over interface (750303,105202123)
945468370	1	Encounter for screening for diabetes mellitus	Received over interface (750303,214025029)
945468371	1	Encounter for screening for lipoid disorders	Received over interface (750303,214025031)
945468372	1	Encounter for general adult medical examination without abnormal findings	Received over interface (750303,214025030)
